mysql> create database book;
Query OK, 1 row affected (0.01 sec)

mysql> show databases;
+--------------------+
| Database           |
+--------------------+
| information_schema |
| book               |
| college            |
| course             |
| data               |
| department         |
| faculty            |
| mysql              |
| performance_schema |
| student            |
| sub                |
| swe                |
| test               |
+--------------------+
13 rows in set (0.03 sec)

mysql> use book;
Database changed
mysql> create table book(bno int(10),bname char(20),publishname char(20),publishcountry char(20));
Query OK, 0 rows affected (0.02 sec)

mysql> insert into book values(121,'SHE','ANAND','africa');
Query OK, 1 row affected (0.01 sec)

mysql> insert into book values(231,'THE MOON','RHEA','america');
Query OK, 1 row affected (0.01 sec)

mysql> insert into book values(521,'THE NIGHTANGLE','CHATERJI','canada');
Query OK, 1 row affected (0.01 sec)

mysql> select * from book;
+------+----------------+-------------+----------------+
| bno  | bname          | publishname | publishcountry |
+------+----------------+-------------+----------------+
|  121 | SHE            | ANAND       | africa         |
|  231 | THE MOON       | RHEA        | america        |
|  521 | THE NIGHTANGLE | CHATERJI    | canada         |
+------+----------------+-------------+----------------+
3 rows in set (0.00 sec)
mysql> delete from book where bno='121';
Query OK, 1 row affected (0.01 sec)

mysql> select * from book;
+------+----------------+-------------+----------------+
| bno  | bname          | publishname | publishcountry |
+------+----------------+-------------+----------------+
|  231 | THE MOON       | RHEA        | america        |
|  521 | THE NIGHTANGLE | CHATERJI    | canada         |
+------+----------------+-------------+----------------+
2 rows in set (0.00 sec)

mysql> create table Hospital(P_NO int(10), P_Name varchar(30), Admitted_Date date, Discharge_Date date);
Query OK, 0 rows affected (0.18 sec)

mysql> insert into hospital values(241, "varu", "2021.7.03", "2021.09.22");
Query OK, 1 row affected (0.07 sec)

mysql> insert into hospital values(275, "rindhi", "2016.1.15", "2018.4.10");
Query OK, 1 row affected (0.09 sec)

mysql> insert into hospital values(753, "Swe", "2010.6.20", "2011.7.30");
Query OK, 1 row affected (0.10 sec)

mysql> select * from hospital;
+------+--------+---------------+----------------+
| P_NO | P_Name | Admitted_Date | Discharge_Date |
+------+--------+---------------+----------------+
|  241 | varu   | 2021-07-03    | 2021-09-22     |
|  275 | rindhi | 2016-01-15    | 2018-04-10     |
|  753 | swe    | 2010-06-20    | 2011-07-30     |
+------+--------+---------------+----------------+
3 rows in set (0.00 sec)

mysql> delete from hospital where P_no = 753;
Query OK, 1 row affected (0.04 sec)

mysql> select * from hospital;
+------+--------+---------------+----------------+
| P_NO | P_Name | Admitted_Date | Discharge_Date |
+------+--------+---------------+----------------+
|  241 | varu  | 2021-07-03     | 2021-09-22     |
|  275 | rindhi  | 2016-01-15   | 2018-04-10     |
+------+--------+---------------+----------------+
2 rows in set (0.00 sec)

mysql> create database car;
Query OK, 1 row affected (0.00 sec)

mysql> show databases;
+--------------------+
| Database           |
+--------------------+
| information_schema |
| book               |
| car                |
| college            |
| course             |
| data               |
| department         |
| faculty            |
| mysql              |
| performance_schema |
| student            |
| sub                |
| swe                |
| test               |
+--------------------+
14 rows in set (0.00 sec)

mysql> use car;
Database changed
mysql> create table car(carname char(10),carno int(10),comapanyname char(10),amount int(20));
Query OK, 0 rows affected (0.01 sec)

mysql> insert into car values('chevy',6754,'ford',20000);
Query OK, 1 row affected (0.01 sec)

mysql> insert into car values('honda fit',6754,'toyota',25000);
Query OK, 1 row affected (0.01 sec)

mysql> insert into car values('porche',6764,'audi',35000);
Query OK, 1 row affected (0.01 sec)

mysql> select * from car;
+-----------+-------+--------------+--------+
| carname   | carno | comapanyname | amount |
+-----------+-------+--------------+--------+
| chevy     |  6754 | ford         |  20000 |
| honda fit |  6754 | toyota       |  25000 |
| porche    |  6764 | audi         |  35000 |
+-----------+-------+--------------+--------+
3 rows in set (0.00 sec)

mysql> update car set carno='6755' where'carname'='honda fit';
Query OK, 0 rows affected (0.00 sec)

mysql> select * from car;
+-----------+-------+--------------+--------+
| carname   | carno | comapanyname | amount |
+-----------+-------+--------------+--------+
| chevy     |  6754 | ford         |  20000 |
| honda fit |  6755 | toyota       |  25000 |
| porche    |  6764 | audi         |  35000 |
+-----------+-------+--------------+--------+
3 rows in set (0.00 sec)

mysql> create table stu_progress(stu_NO int(10), Stu_Name varchar(30), Subject varchar(40), marks int(20)
    -> );
Query OK, 0 rows affected (0.21 sec)

mysql> insert into stu_progress values(125, "Varu", "OS", 79);
Query OK, 1 row affected (0.06 sec)

mysql> insert into stu_progress values(122, "rindhi", "SE", 86);
Query OK, 1 row affected (0.08 sec)

mysql> insert into stu_progress values(111, "swati", "DBMS", 98);
Query OK, 1 row affected (0.07 sec)

mysql> select * from stu_progress;
+--------+----------+----------------+-------+
| stu_NO | Stu_Name | Subject        | marks |
+--------+----------+----------------+-------+
|    125 | Varu     | OS             |    79 |
|    122 |  rindhi  |SE              |    86 |
|    111 | swati    | DBMS           |    98 |
+--------+----------+----------------+-------+
3 rows in set (0.00 sec)

mysql> alter table stu_progress
    -> add Stu_Dept varchar(50) ;
Query OK, 3 rows affected (0.45 sec)
Records: 3  Duplicates: 0  Warnings: 0

mysql> insert into stu_progress values(123, "mylu", "CNS", 89, "CSE");
Query OK, 1 row affected (0.08 sec)

mysql> select * from stu_progress;
+--------+----------+----------------+-------+----------+
| stu_NO | Stu_Name | Subject        | marks | Stu_Dept |
+--------+----------+----------------+-------+----------+
|    125 | varu     | OS             |    79 | NULL     |
|    122 | rindhi   |SE              |    86 | NULL     |
|    111 | swati    | DBMS           |    98 | NULL     |
|    123 | mylu     | CNS            |    89 | CSE      |
+--------+----------+----------------+-------+----------+
4 rows in set (0.00 sec)